{
  "action_categories": [
    {
      "definition": "Reads or displays substantive existing textual content from a file or bounded region.",
      "examples": [],
      "exclude": [
        "Text or symbol matching as the primary operation; use SEARCH_TEXT.",
        "Path enumeration or path predicates; use LIST_PATHS or SEARCH_PATHS.",
        "Binary-byte rendering; use DUMP_BINARY.",
        "Version-control metadata queries; use QUERY_REPOSITORY.",
        "Opening or attempting to read a named path without substantive content; use ACCESS_FILE."
      ],
      "id": "READ_TEXT",
      "include": [
        "Reading source, headers, scripts, configuration, patches, changelogs, logs, or textual excerpts.",
        "Using a command whose primary effect is emitting existing text."
      ]
    }
  ],
  "message_roles": [],
  "message_subjects": [],
  "name": "observable_agent_behavior_ontology",
  "object_categories": [],
  "version": 7
}
